-- Task 4: Delete Incorrect Records
-- Objective: Clean and maintain data quality

USE covid_db;

-- First, insert some incorrect records for demonstration
INSERT INTO covid_cases (country, report_date, confirmed_cases, deaths, recoveries, population) VALUES
('IN', '2021-05-01', 19500000, 215000, 17500000, 1380004385),
('India', '2021-05-01', 19500000, 215000, 17500000, 1380004385),
('USA', '2021-05-01', 32300000, 575000, 25000000, 331002651);

-- View current data with potential issues
SELECT * FROM covid_cases ORDER BY country, report_date;

-- 1. Delete records with incorrect country name (e.g., 'IN' instead of 'India')
DELETE FROM covid_cases
WHERE country = 'IN';

-- Verify removal of incorrect country
SELECT * FROM covid_cases WHERE country = 'IN';

-- 2. Remove duplicate records for the same country and date
-- Keep the row with the lowest id (first inserted)
DELETE c1 FROM covid_cases c1
INNER JOIN covid_cases c2
WHERE c1.id > c2.id
  AND c1.country = c2.country
  AND c1.report_date = c2.report_date;

-- Verify duplicates are removed
SELECT country, report_date, COUNT(*)
FROM covid_cases
GROUP BY country, report_date
HAVING COUNT(*) > 1;

-- 3. Delete old records (before a specific date) if needed
DELETE FROM covid_cases
WHERE report_date < '2021-01-01';

-- 4. Delete records with zero or invalid data
DELETE FROM covid_cases
WHERE confirmed_cases <= 0
   OR country = '';

-- Final verification of clean data
SELECT * FROM covid_cases ORDER BY country, report_date;

-- Show total records remaining
SELECT COUNT(*) AS total_records FROM covid_cases;

-- Terminal Command:
-- mysql -u root -p < covid_data_deletion.txt

-- ============================================================
-- OUTPUT
-- ============================================================

mysql> USE covid_db;
Database changed

mysql> INSERT INTO covid_cases (country, report_date, confirmed_cases, deaths, recoveries, population) VALUES
    -> ('IN', '2021-05-01', 19500000, 215000, 17500000, 1380004385),
    -> ('India', '2021-05-01', 19500000, 215000, 17500000, 1380004385),
    -> ('USA', '2021-05-01', 32300000, 575000, 25000000, 331002651);
Query OK, 3 rows affected (0.01 sec)

mysql> SELECT * FROM covid_cases ORDER BY country, report_date;
+----+---------+-------------+-----------------+--------+-----------+------------+
| id | country | report_date | confirmed_cases | deaths | recoveries | population |
+----+---------+-------------+-----------------+--------+-----------+------------+
| 13 | IN      | 2021-05-01 |        19500000 | 215000 |  17500000 |  1380004385 |
|  9 | UK      | 2021-05-01 |         4400000 | 133350 |   3500000 |   67886011 |
| 10 | UK      | 2021-06-01 |         4500000 | 134400 |   4000000 |   67886011 |
| 11 | UK      | 2021-07-01 |         4900000 | 135450 |   4300000 |   67886011 |
| 12 | UK      | 2021-08-01 |         6200000 | 137550 |   5000000 |   67886011 |
|  1 | India   | 2021-05-01 |        19500000 | 215000 |  17500000 |  1380004385 |
| 14 | India   | 2021-05-01 |        19500000 | 215000 |  17500000 |  1380004385 |
|  2 | India   | 2021-06-01 |        28500000 | 342000 |  26000000 |  1380004385 |
|  3 | India   | 2021-07-01 |        30500000 | 400000 |  29500000 |  1380004385 |
|  4 | India   | 2021-08-01 |        31800000 | 425000 |  31000000 |  1380004385 |
|  5 | USA     | 2021-05-01 |        32300000 | 575000 |  25500000 |   331002651 |
| 15 | USA     | 2021-05-01 |        32300000 | 575000 |  25000000 |   331002651 |
|  6 | USA     | 2021-06-01 |        33500000 | 598000 |  28000000 |   331002651 |
|  7 | USA     | 2021-07-01 |        34200000 | 610000 |  29500000 |   331002651 |
|  8 | USA     | 2021-08-01 |        35800000 | 625000 |  31000000 |   331002651 |
+----+---------+-------------+-----------------+--------+-----------+------------+
15 rows in set (0.00 sec)

mysql> DELETE FROM covid_cases
    -> WHERE country = 'IN';
Query OK, 1 row affected (0.01 sec)

mysql> SELECT * FROM covid_cases WHERE country = 'IN';
Empty set (0.00 sec)

mysql> DELETE c1 FROM covid_cases c1
    -> INNER JOIN covid_cases c2
    -> WHERE c1.id > c2.id
    ->   AND c1.country = c2.country
    ->   AND c1.report_date = c2.report_date;
Query OK, 2 rows affected (0.01 sec)

mysql> SELECT country, report_date, COUNT(*)
    -> FROM covid_cases
    -> GROUP BY country, report_date
    -> HAVING COUNT(*) > 1;
Empty set (0.00 sec)

mysql> DELETE FROM covid_cases
    -> WHERE report_date < '2021-01-01';
Query OK, 0 rows affected (0.00 sec)

mysql> DELETE FROM covid_cases
    -> WHERE confirmed_cases <= 0
    ->    OR country = '';
Query OK, 0 rows affected (0.00 sec)

mysql> SELECT * FROM covid_cases ORDER BY country, report_date;
+----+---------+-------------+-----------------+--------+-----------+------------+
| id | country | report_date | confirmed_cases | deaths | recoveries | population |
+----+---------+-------------+-----------------+--------+-----------+------------+
|  9 | UK      | 2021-05-01 |         4400000 | 133350 |   3500000 |   67886011 |
| 10 | UK      | 2021-06-01 |         4500000 | 134400 |   4000000 |   67886011 |
| 11 | UK      | 2021-07-01 |         4900000 | 135450 |   4300000 |   67886011 |
| 12 | UK      | 2021-08-01 |         6200000 | 137550 |   5000000 |   67886011 |
|  1 | India   | 2021-05-01 |        19500000 | 215000 |  17500000 |  1380004385 |
|  2 | India   | 2021-06-01 |        28500000 | 342000 |  26000000 |  1380004385 |
|  3 | India   | 2021-07-01 |        30500000 | 400000 |  29500000 |  1380004385 |
|  4 | India   | 2021-08-01 |        31800000 | 425000 |  31000000 |  1380004385 |
|  5 | USA     | 2021-05-01 |        32300000 | 575000 |  25500000 |   331002651 |
|  6 | USA     | 2021-06-01 |        33500000 | 598000 |  28000000 |   331002651 |
|  7 | USA     | 2021-07-01 |        34200000 | 610000 |  29500000 |   331002651 |
|  8 | USA     | 2021-08-01 |        35800000 | 625000 |  31000000 |   331002651 |
+----+---------+-------------+-----------------+--------+-----------+------------+
12 rows in set (0.00 sec)

mysql> SELECT COUNT(*) AS total_records FROM covid_cases;
+---------------+
| total_records |
+---------------+
|            12 |
+---------------+
1 row in set (0.00 sec)
